{
  "arxiv_id": "2402.19088",
  "title": "Survey in Characterization of Semantic Change",
  "venue_gold": {
    "status": "preprint",
    "name": null,
    "type": "preprint",
    "year": null,
    "doi": null,
    "evidence_url": null,
    "notes": ""
  },
  "authors_gold": [
    {
      "index": 0,
      "author_name": "Jader Martins Camboim de S'a",
      "affiliations": [
        {
          "name": "FSTM- University of Luxembourg"
        },
        {
          "name": "Luxembourg Institute of Science and Technology"
        }
      ],
      "evidence": "pdf_first_page",
      "notes": ""
    },
    {
      "index": 1,
      "author_name": "Marcos Da Silveira",
      "affiliations": [
        {
          "name": "Luxembourg Institute of Science and Technology"
        }
      ],
      "evidence": "pdf_first_page",
      "notes": ""
    },
    {
      "index": 2,
      "author_name": "C. Pruski",
      "affiliations": [
        {
          "name": "Luxembourg Institute of Science and Technology"
        }
      ],
      "evidence": "pdf_first_page",
      "notes": ""
    }
  ],
  "authors_list_fix": null,
  "resource_links_gold": {
    "original": [
      {
        "index": 0,
        "url": "https://researchrabbitapp.com/",
        "link_class": "cited_external",
        "notes": ""
      },
      {
        "index": 1,
        "url": "https://anc.org/data/masc/corpus/",
        "link_class": "cited_external",
        "notes": ""
      },
      {
        "index": 2,
        "url": "https://link.springer.com/article/10.1007/s00500-024-10042-4",
        "link_class": "cited_external",
        "notes": ""
      }
    ],
    "added": []
  },
  "annotator_meta": {
    "annotator_id": "A01",
    "annotated_at": "2026-07-14T11:52:47.695Z",
    "minutes_spent": 7.3,
    "difficulty": "hard",
    "confidence": 0.8
  }
}
