{
  "arxiv_id": "2402.09725",
  "title": "Improving Non-autoregressive Machine Translation with Error Exposure and Consistency Regularization",
  "venue_gold": {
    "status": "published",
    "name": "NLPCC 2024",
    "type": "conference",
    "year": 2024,
    "doi": "10.1007/978-981-97-9437-9_19",
    "evidence_url": "https://dl.acm.org/doi/abs/10.1007/978-981-97-9437-9_19",
    "notes": ""
  },
  "authors_gold": [
    {
      "index": 0,
      "author_name": "Xinran Chen",
      "affiliations": [
        {
          "name": "School of Electronic Information and Electrical Engineering, Shanghai Jiao Tong University"
        }
      ],
      "evidence": "pdf_first_page",
      "notes": ""
    },
    {
      "index": 1,
      "author_name": "Sufeng Duan",
      "affiliations": [
        {
          "name": "School of Electronic Information and Electrical Engineering, Shanghai Jiao Tong University"
        }
      ],
      "evidence": "pdf_first_page",
      "notes": ""
    },
    {
      "index": 2,
      "author_name": "Gongshen Liu",
      "affiliations": [
        {
          "name": "School of Electronic Information and Electrical Engineering, Shanghai Jiao Tong University"
        }
      ],
      "evidence": "pdf_first_page",
      "notes": ""
    }
  ],
  "authors_list_fix": null,
  "resource_links_gold": {
    "original": [],
    "added": []
  },
  "annotator_meta": {
    "annotator_id": "A01",
    "annotated_at": "2026-07-14T06:19:22.644Z",
    "minutes_spent": 217.4,
    "difficulty": "easy",
    "confidence": 1
  }
}
