{
  "arxiv_id": "2408.10889",
  "title": "On Learning Action Costs from Input Plans",
  "venue_gold": {
    "status": "published",
    "name": "EACL 2025",
    "type": "conference",
    "year": 2025,
    "doi": "10.3233/FAIA250976",
    "evidence_url": "https://ebooks.iospress.nl/doi/10.3233/FAIA250976",
    "notes": ""
  },
  "authors_gold": [
    {
      "index": 0,
      "author_name": "Marianela Morales",
      "affiliations": [
        {
          "name": "J.P. Morgan AI Research"
        }
      ],
      "evidence": "pdf_first_page",
      "notes": ""
    },
    {
      "index": 1,
      "author_name": "Alberto Pozanco",
      "affiliations": [
        {
          "name": "J.P. Morgan AI Research"
        }
      ],
      "evidence": "pdf_first_page",
      "notes": ""
    },
    {
      "index": 2,
      "author_name": "Giuseppe Canonaco",
      "affiliations": [
        {
          "name": "J.P. Morgan AI Research"
        }
      ],
      "evidence": "pdf_first_page",
      "notes": ""
    },
    {
      "index": 3,
      "author_name": "Sriram Gopalakrishnan",
      "affiliations": [
        {
          "name": "J.P. Morgan AI Research"
        }
      ],
      "evidence": "pdf_first_page",
      "notes": ""
    },
    {
      "index": 4,
      "author_name": "Daniel Borrajo",
      "affiliations": [
        {
          "name": "J.P. Morgan AI Research"
        }
      ],
      "evidence": "pdf_first_page",
      "notes": ""
    },
    {
      "index": 5,
      "author_name": "Manuela M. Veloso",
      "affiliations": [
        {
          "name": "J.P. Morgan AI Research"
        }
      ],
      "evidence": "pdf_first_page",
      "notes": ""
    }
  ],
  "authors_list_fix": null,
  "resource_links_gold": {
    "original": [],
    "added": []
  },
  "annotator_meta": {
    "annotator_id": "A01",
    "annotated_at": "2026-07-14T16:03:30.062Z",
    "minutes_spent": 1.3,
    "difficulty": "easy",
    "confidence": 0.95
  }
}
