{
  "arxiv_id": "2402.19465",
  "title": "Towards Tracing Trustworthiness Dynamics: Revisiting Pre-training Period of Large Language Models",
  "venue_gold": {
    "status": "published",
    "name": "ACL 2024 Findings",
    "type": "conference",
    "year": 2024,
    "doi": "10.18653/v1/2024.findings-acl.290",
    "evidence_url": "https://aclanthology.org/2024.findings-acl.290/",
    "notes": ""
  },
  "authors_gold": [
    {
      "index": 0,
      "author_name": "Chen Qian",
      "affiliations": [
        {
          "name": "Shanghai Artificial Intelligence Laboratory"
        },
        {
          "name": "Renmin University of China"
        }
      ],
      "evidence": "pdf_first_page",
      "notes": ""
    },
    {
      "index": 1,
      "author_name": "Jie Zhang",
      "affiliations": [
        {
          "name": "Shanghai Artificial Intelligence Laboratory"
        },
        {
          "name": "University of Chinese Academy of Sciences"
        }
      ],
      "evidence": "pdf_first_page",
      "notes": ""
    },
    {
      "index": 2,
      "author_name": "Wei Yao",
      "affiliations": [
        {
          "name": "Shanghai Artificial Intelligence Laboratory"
        },
        {
          "name": "Renmin University of China"
        }
      ],
      "evidence": "pdf_first_page",
      "notes": ""
    },
    {
      "index": 3,
      "author_name": "Dongrui Liu",
      "affiliations": [
        {
          "name": "Shanghai Artificial Intelligence Laboratory"
        },
        {
          "name": "Shanghai Jiao Tong University"
        }
      ],
      "evidence": "pdf_first_page",
      "notes": ""
    },
    {
      "index": 4,
      "author_name": "Zhen-fei Yin",
      "affiliations": [
        {
          "name": "Shanghai Artificial Intelligence Laboratory"
        },
        {
          "name": "The University of Sydney"
        }
      ],
      "evidence": "pdf_first_page",
      "notes": ""
    },
    {
      "index": 5,
      "author_name": "Yu Qiao",
      "affiliations": [
        {
          "name": "Shanghai Artificial Intelligence Laboratory"
        }
      ],
      "evidence": "pdf_first_page",
      "notes": ""
    },
    {
      "index": 6,
      "author_name": "Yong Liu",
      "affiliations": [
        {
          "name": "Renmin University of China"
        }
      ],
      "evidence": "pdf_first_page",
      "notes": ""
    },
    {
      "index": 7,
      "author_name": "Jing Shao",
      "affiliations": [
        {
          "name": "Shanghai Artificial Intelligence Laboratory"
        }
      ],
      "evidence": "pdf_first_page",
      "notes": ""
    }
  ],
  "authors_list_fix": null,
  "resource_links_gold": {
    "original": [
      {
        "index": 0,
        "url": "https://github.com/ChnQ/TracingLLM",
        "link_class": "official_code",
        "notes": ""
      },
      {
        "index": 1,
        "url": "https://github.com/LLM360/amber-train",
        "link_class": "cited_external",
        "notes": ""
      },
      {
        "index": 2,
        "url": "https://www.latex-project.org/help/documentation/encguide.pdf",
        "link_class": "template_boilerplate",
        "notes": ""
      },
      {
        "index": 3,
        "url": "https://huggingface.co/datasets/PKU-Alignment/PKU-SafeRLHF-10K",
        "link_class": "cited_external",
        "notes": ""
      },
      {
        "index": 4,
        "url": "https://openai.com/index/introducing-superalignment/",
        "link_class": "cited_external",
        "notes": ""
      }
    ],
    "added": []
  },
  "annotator_meta": {
    "annotator_id": "A01",
    "annotated_at": "2026-07-14T11:56:07.139Z",
    "minutes_spent": 3.3,
    "difficulty": "easy",
    "confidence": 0.9
  }
}
