{
  "arxiv_id": "2402.16904",
  "title": "Selective Task offloading for Maximum Inference Accuracy and Energy efficient Real-Time IoT Sensing Systems",
  "venue_gold": {
    "status": "preprint",
    "name": "2024",
    "type": "preprint",
    "year": null,
    "doi": null,
    "evidence_url": null,
    "notes": "dblp上没有发表信息"
  },
  "authors_gold": [
    {
      "index": 0,
      "author_name": "Abdelkarim Ben Sada",
      "affiliations": [
        {
          "name": "University of Science and Technology Beijing"
        }
      ],
      "evidence": "pdf_first_page",
      "notes": ""
    },
    {
      "index": 1,
      "author_name": "Amar Khelloufi",
      "affiliations": [
        {
          "name": "University of Science and Technology Beijing"
        }
      ],
      "evidence": "pdf_first_page",
      "notes": ""
    },
    {
      "index": 2,
      "author_name": "Abdenacer Naouri",
      "affiliations": [
        {
          "name": "University of Science and Technology Beijing"
        }
      ],
      "evidence": "pdf_first_page",
      "notes": ""
    },
    {
      "index": 3,
      "author_name": "Huansheng Ning",
      "affiliations": [
        {
          "name": "University of Science and Technology Beijing"
        }
      ],
      "evidence": "pdf_first_page",
      "notes": ""
    },
    {
      "index": 4,
      "author_name": "Sahraoui Dhelim",
      "affiliations": [
        {
          "name": "School of Computer Science, University College Dublin"
        }
      ],
      "evidence": "pdf_first_page",
      "notes": ""
    }
  ],
  "authors_list_fix": null,
  "resource_links_gold": {
    "original": [],
    "added": []
  },
  "annotator_meta": {
    "annotator_id": "A01",
    "annotated_at": "2026-07-14T11:40:25.713Z",
    "minutes_spent": 2.3,
    "difficulty": "medium",
    "confidence": 0.9
  }
}
