{
  "arxiv_id": "2403.07483",
  "title": "DiabetesNet: A Deep Learning Approach to Diabetes Diagnosis",
  "venue_gold": {
    "status": "published",
    "name": "ACIIDS 2024",
    "type": "conference",
    "year": 2024,
    "doi": "10.1007/978-981-97-5937-8_8",
    "evidence_url": "https://link.springer.com/chapter/10.1007/978-981-97-5937-8_8",
    "notes": ""
  },
  "authors_gold": [
    {
      "index": 0,
      "author_name": "Zeyu Zhang",
      "affiliations": [
        {
          "name": "Australian National University"
        }
      ],
      "evidence": "pdf_first_page",
      "notes": ""
    },
    {
      "index": 1,
      "author_name": "K. A. Ahmed",
      "affiliations": [
        {
          "name": "Commonwealth Scientific and Industrial Research Organisation"
        }
      ],
      "evidence": "pdf_first_page",
      "notes": ""
    },
    {
      "index": 2,
      "author_name": "Md Rakibul Hasan",
      "affiliations": [
        {
          "name": "Curtin University"
        }
      ],
      "evidence": "pdf_first_page",
      "notes": ""
    },
    {
      "index": 3,
      "author_name": "Tom Gedeon",
      "affiliations": [
        {
          "name": "Australian National University"
        },
        {
          "name": "Curtin University"
        },
        {
          "name": "Obuda University"
        }
      ],
      "evidence": "pdf_first_page",
      "notes": ""
    },
    {
      "index": 4,
      "author_name": "Md. Zakir Hossain",
      "affiliations": [
        {
          "name": "Australian National University"
        },
        {
          "name": "Commonwealth Scientific and Industrial Research Organisation"
        },
        {
          "name": "Curtin University"
        }
      ],
      "evidence": "pdf_first_page",
      "notes": ""
    }
  ],
  "authors_list_fix": null,
  "resource_links_gold": {
    "original": [
      {
        "index": 0,
        "url": "https://steve-zeyu-zhang.github.io/DiabetesDiagnosis",
        "link_class": "official_project",
        "notes": ""
      }
    ],
    "added": []
  },
  "annotator_meta": {
    "annotator_id": "A01",
    "annotated_at": "2026-07-14T15:41:06.582Z",
    "minutes_spent": 2.6,
    "difficulty": "easy",
    "confidence": 1
  }
}
