{
  "arxiv_id": "2402.03175",
  "title": "Beyond the Black Box: A Statistical Model for LLM Reasoning and Inference",
  "venue_gold": {
    "status": "preprint",
    "name": null,
    "type": "preprint",
    "year": null,
    "doi": null,
    "evidence_url": null,
    "notes": ""
  },
  "authors_gold": [
    {
      "index": 0,
      "author_name": "Siddhartha R. Dalal",
      "affiliations": [
        {
          "name": "Statistics Department and School of Professional Studies, Columbia University,"
        }
      ],
      "evidence": "pdf_first_page",
      "notes": ""
    },
    {
      "index": 1,
      "author_name": "Vishal Misra",
      "affiliations": [
        {
          "name": "Computer Science Department, Columbia University"
        }
      ],
      "evidence": "pdf_first_page",
      "notes": ""
    }
  ],
  "authors_list_fix": null,
  "resource_links_gold": {
    "original": [],
    "added": []
  },
  "annotator_meta": {
    "annotator_id": "A01",
    "annotated_at": "2026-07-14T02:27:34.181Z",
    "minutes_spent": 2.4,
    "difficulty": "medium",
    "confidence": 0.8
  }
}
