{
  "arxiv_id": "2405.20204",
  "title": "Jina CLIP: Your CLIP Model Is Also Your Text Retriever",
  "venue_gold": {
    "status": "published",
    "name": "MFM-EAI@ICML2024",
    "type": "workshop",
    "year": 2024,
    "doi": null,
    "evidence_url": null,
    "notes": ""
  },
  "authors_gold": [
    {
      "index": 0,
      "author_name": "Andreas Koukounas",
      "affiliations": [
        {
          "name": "Jina AI GmbH"
        }
      ],
      "evidence": "pdf_first_page",
      "notes": ""
    },
    {
      "index": 1,
      "author_name": "Georgios Mastrapas",
      "affiliations": [
        {
          "name": "Jina AI GmbH"
        }
      ],
      "evidence": "pdf_first_page",
      "notes": ""
    },
    {
      "index": 2,
      "author_name": "Michael Günther",
      "affiliations": [
        {
          "name": "Jina AI GmbH"
        }
      ],
      "evidence": "pdf_first_page",
      "notes": ""
    },
    {
      "index": 3,
      "author_name": "Bo Wang",
      "affiliations": [
        {
          "name": "Jina AI GmbH"
        }
      ],
      "evidence": "pdf_first_page",
      "notes": ""
    },
    {
      "index": 4,
      "author_name": "Scott Martens",
      "affiliations": [
        {
          "name": "Jina AI GmbH"
        }
      ],
      "evidence": "pdf_first_page",
      "notes": ""
    },
    {
      "index": 5,
      "author_name": "Isabelle Mohr",
      "affiliations": [
        {
          "name": "Jina AI GmbH"
        }
      ],
      "evidence": "pdf_first_page",
      "notes": ""
    },
    {
      "index": 6,
      "author_name": "Saba Sturua",
      "affiliations": [
        {
          "name": "Jina AI GmbH"
        }
      ],
      "evidence": "pdf_first_page",
      "notes": ""
    },
    {
      "index": 7,
      "author_name": "Mohammad Kalim Akram",
      "affiliations": [
        {
          "name": "Jina AI GmbH"
        }
      ],
      "evidence": "pdf_first_page",
      "notes": ""
    },
    {
      "index": 8,
      "author_name": "Joan Fontanals Mart'inez",
      "affiliations": [
        {
          "name": "Jina AI GmbH"
        }
      ],
      "evidence": "pdf_first_page",
      "notes": ""
    },
    {
      "index": 9,
      "author_name": "Saahil Ognawala",
      "affiliations": [
        {
          "name": "Jina AI GmbH"
        }
      ],
      "evidence": "pdf_first_page",
      "notes": ""
    },
    {
      "index": 10,
      "author_name": "Susana Guzman",
      "affiliations": [
        {
          "name": "Jina AI GmbH"
        }
      ],
      "evidence": "pdf_first_page",
      "notes": ""
    },
    {
      "index": 11,
      "author_name": "Maximilian Werk",
      "affiliations": [
        {
          "name": "Jina AI GmbH"
        }
      ],
      "evidence": "pdf_first_page",
      "notes": ""
    },
    {
      "index": 12,
      "author_name": "Nan Wang",
      "affiliations": [
        {
          "name": "Jina AI GmbH"
        }
      ],
      "evidence": "pdf_first_page",
      "notes": ""
    },
    {
      "index": 13,
      "author_name": "Han Xiao",
      "affiliations": [
        {
          "name": "Jina AI GmbH"
        }
      ],
      "evidence": "pdf_first_page",
      "notes": ""
    }
  ],
  "authors_list_fix": null,
  "resource_links_gold": {
    "original": [
      {
        "index": 0,
        "url": "https://github.com/LAION-AI/CLIP_benchmark",
        "link_class": "cited_external",
        "notes": ""
      },
      {
        "index": 1,
        "url": "https://huggingface.co/jinaai/jina-embeddings-v2-base-en",
        "link_class": "official_code",
        "notes": ""
      },
      {
        "index": 2,
        "url": "https://huggingface.co/jinaai/jina-clip-v1",
        "link_class": "official_code",
        "notes": ""
      }
    ],
    "added": []
  },
  "annotator_meta": {
    "annotator_id": "A01",
    "annotated_at": "2026-07-14T15:56:06.495Z",
    "minutes_spent": 2.8,
    "difficulty": "medium",
    "confidence": 0.9
  }
}
