{
  "arxiv_id": "2407.12352",
  "title": "SENTAUR: Security EnhaNced Trojan Assessment Using LLMs Against Undesirable Revisions",
  "venue_gold": {
    "status": "preprint",
    "name": "2024",
    "type": "preprint",
    "year": null,
    "doi": null,
    "evidence_url": "https://dblp.org/rec/journals/corr/abs-2407-12352.html",
    "notes": ""
  },
  "authors_gold": [
    {
      "index": 0,
      "author_name": "Jitendra Bhandari",
      "affiliations": [
        {
          "name": "New York University"
        }
      ],
      "evidence": "pdf_first_page",
      "notes": ""
    },
    {
      "index": 1,
      "author_name": "Rajat Sadhukhan",
      "affiliations": [
        {
          "name": "New York University"
        }
      ],
      "evidence": "pdf_first_page",
      "notes": ""
    },
    {
      "index": 2,
      "author_name": "P. Krishnamurthy",
      "affiliations": [
        {
          "name": "New York University"
        }
      ],
      "evidence": "pdf_first_page",
      "notes": ""
    },
    {
      "index": 3,
      "author_name": "F. Khorrami",
      "affiliations": [
        {
          "name": "New York University"
        }
      ],
      "evidence": "pdf_first_page",
      "notes": ""
    },
    {
      "index": 4,
      "author_name": "Ramesh Karri",
      "affiliations": [
        {
          "name": "New York University"
        }
      ],
      "evidence": "pdf_first_page",
      "notes": ""
    }
  ],
  "authors_list_fix": null,
  "resource_links_gold": {
    "original": [],
    "added": []
  },
  "annotator_meta": {
    "annotator_id": "A01",
    "annotated_at": "2026-07-14T15:58:42.139Z",
    "minutes_spent": 0.9,
    "difficulty": "medium",
    "confidence": 0.85
  }
}
