{
  "arxiv_id": "2404.18001",
  "title": "LLMParser: An Exploratory Study on Using Large Language Models for Log Parsing",
  "venue_gold": {
    "status": "published",
    "name": "ICSE 2024",
    "type": "conference",
    "year": 2024,
    "doi": "10.1145/3597503.3639150",
    "evidence_url": "https://ieeexplore.ieee.org/document/10548600",
    "notes": ""
  },
  "authors_gold": [
    {
      "index": 0,
      "author_name": "Zeyang Ma",
      "affiliations": [
        {
          "name": "Software PErformance, Analysis and Reliability (SPEAR) Lab, Concordia University"
        }
      ],
      "evidence": "pdf_first_page",
      "notes": ""
    },
    {
      "index": 1,
      "author_name": "A. Chen",
      "affiliations": [
        {
          "name": "Electrical and Computer Engineering Department, University of Alberta"
        }
      ],
      "evidence": "pdf_first_page",
      "notes": ""
    },
    {
      "index": 2,
      "author_name": "Dong Jae Kim",
      "affiliations": [
        {
          "name": "Software PErformance, Analysis and Reliability (SPEAR) Lab, Concordia University"
        }
      ],
      "evidence": "pdf_first_page",
      "notes": ""
    },
    {
      "index": 3,
      "author_name": "Tse-Husn Chen",
      "affiliations": [
        {
          "name": "Software PErformance, Analysis and Reliability (SPEAR) Lab, Concordia University"
        }
      ],
      "evidence": "pdf_first_page",
      "notes": ""
    },
    {
      "index": 4,
      "author_name": "Shaowei Wang",
      "affiliations": [
        {
          "name": "Department of Computer Science, University of Manitoba"
        }
      ],
      "evidence": "pdf_first_page",
      "notes": ""
    }
  ],
  "authors_list_fix": null,
  "resource_links_gold": {
    "original": [],
    "added": []
  },
  "annotator_meta": {
    "annotator_id": "A01",
    "annotated_at": "2026-07-14T15:52:55.166Z",
    "minutes_spent": 2,
    "difficulty": "easy",
    "confidence": 1
  }
}
