{
  "arxiv_id": "2401.16795",
  "title": "Performance Insights-based AI-driven Football Transfer Fee Prediction",
  "venue_gold": {
    "status": "preprint",
    "name": null,
    "type": "preprint",
    "year": 2024,
    "doi": null,
    "evidence_url": null,
    "notes": "unknown"
  },
  "authors_gold": [
    {
      "index": 0,
      "author_name": "Daniil Sulimov",
      "affiliations": [
        {
          "name": "HSE University"
        }
      ],
      "evidence": "pdf_first_page",
      "notes": ""
    }
  ],
  "authors_list_fix": null,
  "resource_links_gold": {
    "original": [
      {
        "index": 0,
        "url": "https://github.com/statsbomb/open-data",
        "link_class": "official_dataset",
        "notes": ""
      },
      {
        "index": 1,
        "url": "https://www.kaggle.com/datasets/davidcariboo/player-scores",
        "link_class": "cited_external",
        "notes": ""
      },
      {
        "index": 2,
        "url": "https://doi.org/10.1145/3097983.3098051",
        "link_class": "cited_external",
        "notes": ""
      },
      {
        "index": 3,
        "url": "https://doi.org/10.1007/978-3-030-17274-9\\_1",
        "link_class": "cited_external",
        "notes": ""
      },
      {
        "index": 4,
        "url": "https://doi.org/10.1089/big.2018.0067",
        "link_class": "other",
        "notes": ""
      },
      {
        "index": 5,
        "url": "https://doi.org/10.3389/fspor.2021.624475",
        "link_class": "other",
        "notes": ""
      },
      {
        "index": 6,
        "url": "10.3390/economies10010004",
        "link_class": "cited_external",
        "notes": ""
      },
      {
        "index": 7,
        "url": "10.1007/s10618-020-00705-9",
        "link_class": "cited_external",
        "notes": ""
      },
      {
        "index": 8,
        "url": "10.1016/j.ejor.2022.06.033",
        "link_class": "other",
        "notes": ""
      },
      {
        "index": 9,
        "url": "https://doi.org/10.1007/978-3-031-02044-5\\_4",
        "link_class": "cited_external",
        "notes": ""
      },
      {
        "index": 10,
        "url": "doi: 10.1080/24748668.2021.2012040",
        "link_class": "cited_external",
        "notes": ""
      },
      {
        "index": 11,
        "url": "10.24963/ijcai.2018/478",
        "link_class": "cited_external",
        "notes": ""
      },
      {
        "index": 12,
        "url": "https://doi.org/10.1007/978-3-030-67670-4\\_30",
        "link_class": "cited_external",
        "notes": ""
      },
      {
        "index": 13,
        "url": "10.1080/24748668.2012.11868611",
        "link_class": "cited_external",
        "notes": ""
      },
      {
        "index": 14,
        "url": "10.1080/24748668.2018.1517290",
        "link_class": "cited_external",
        "notes": ""
      },
      {
        "index": 15,
        "url": "doi: 10.1109/ICSCAN.2019.8878843",
        "link_class": "cited_external",
        "notes": ""
      },
      {
        "index": 16,
        "url": "https://doi.org/10.1016/j.humov.2017.07.010",
        "link_class": "cited_external",
        "notes": ""
      },
      {
        "index": 17,
        "url": "https://doi.org/10.1145/3292500.3330758",
        "link_class": "cited_external",
        "notes": ""
      }
    ],
    "added": []
  },
  "annotator_meta": {
    "annotator_id": "A01",
    "annotated_at": "2026-07-14T02:16:08.433Z",
    "minutes_spent": 3.6,
    "difficulty": "medium",
    "confidence": 0.8
  }
}
