{
  "arxiv_id": "2402.12847",
  "title": "Instruction-tuned Language Models are Better Knowledge Learners",
  "venue_gold": {
    "status": "published",
    "name": "ACL 2024",
    "type": "conference",
    "year": 2024,
    "doi": "10.18653/v1/2024.acl-long.296",
    "evidence_url": "https://aclanthology.org/2024.acl-long.296/",
    "notes": ""
  },
  "authors_gold": [
    {
      "index": 0,
      "author_name": "Zhengbao Jiang",
      "affiliations": [
        {
          "name": "FAIR at Meta"
        }
      ],
      "evidence": "pdf_first_page",
      "notes": ""
    },
    {
      "index": 1,
      "author_name": "Zhiqing Sun",
      "affiliations": [
        {
          "name": "Carnegie Mellon University"
        }
      ],
      "evidence": "pdf_first_page",
      "notes": ""
    },
    {
      "index": 2,
      "author_name": "Weijia Shi",
      "affiliations": [
        {
          "name": "FAIR at Meta"
        },
        {
          "name": "University of Washington"
        }
      ],
      "evidence": "pdf_first_page",
      "notes": ""
    },
    {
      "index": 3,
      "author_name": "Pedro Rodriguez",
      "affiliations": [
        {
          "name": "FAIR at Meta"
        }
      ],
      "evidence": "pdf_first_page",
      "notes": ""
    },
    {
      "index": 4,
      "author_name": "Chunting Zhou",
      "affiliations": [
        {
          "name": "FAIR at Meta"
        }
      ],
      "evidence": "pdf_first_page",
      "notes": ""
    },
    {
      "index": 5,
      "author_name": "Graham Neubig",
      "affiliations": [
        {
          "name": "Carnegie Mellon University"
        }
      ],
      "evidence": "pdf_first_page",
      "notes": ""
    },
    {
      "index": 6,
      "author_name": "Xi Victoria Lin",
      "affiliations": [
        {
          "name": "FAIR at Meta"
        }
      ],
      "evidence": "pdf_first_page",
      "notes": ""
    },
    {
      "index": 7,
      "author_name": "Wen-tau Yih",
      "affiliations": [
        {
          "name": "FAIR at Meta"
        }
      ],
      "evidence": "pdf_first_page",
      "notes": ""
    },
    {
      "index": 8,
      "author_name": "Srinivasan Iyer",
      "affiliations": [
        {
          "name": "FAIR at Meta"
        }
      ],
      "evidence": "pdf_first_page",
      "notes": ""
    }
  ],
  "authors_list_fix": null,
  "resource_links_gold": {
    "original": [
      {
        "index": 0,
        "url": "https://anonymous",
        "link_class": "other",
        "notes": ""
      },
      {
        "index": 1,
        "url": "https://en.wikipedia.org/wiki/Category:2023",
        "link_class": "cited_external",
        "notes": ""
      },
      {
        "index": 2,
        "url": "https://www.latex-project.org/help/documentation/encguide.pdf",
        "link_class": "template_boilerplate",
        "notes": ""
      }
    ],
    "added": []
  },
  "annotator_meta": {
    "annotator_id": "A01",
    "annotated_at": "2026-07-14T15:38:16.285Z",
    "minutes_spent": 1.3,
    "difficulty": "easy",
    "confidence": 0.95
  }
}
