{
  "arxiv_id": "2407.12410",
  "title": "Proximity-based Self-Federated Learning",
  "venue_gold": {
    "status": "published",
    "name": "ACSOS 2024",
    "type": "conference",
    "year": 2024,
    "doi": "10.1109/ACSOS61780.2024.00033",
    "evidence_url": "https://ieeexplore.ieee.org/document/10771268",
    "notes": ""
  },
  "authors_gold": [
    {
      "index": 0,
      "author_name": "D. Domini",
      "affiliations": [
        {
          "name": "University of Bologna"
        }
      ],
      "evidence": "pdf_first_page",
      "notes": ""
    },
    {
      "index": 1,
      "author_name": "G. Aguzzi",
      "affiliations": [
        {
          "name": "University of Bologna"
        }
      ],
      "evidence": "pdf_first_page",
      "notes": ""
    },
    {
      "index": 2,
      "author_name": "Nicolas Farabegoli",
      "affiliations": [
        {
          "name": "University of Bologna"
        }
      ],
      "evidence": "pdf_first_page",
      "notes": ""
    },
    {
      "index": 3,
      "author_name": "Mirko Viroli",
      "affiliations": [
        {
          "name": "University of Bologna"
        }
      ],
      "evidence": "pdf_first_page",
      "notes": ""
    },
    {
      "index": 4,
      "author_name": "L. Esterle",
      "affiliations": [
        {
          "name": "Aarhus University"
        }
      ],
      "evidence": "pdf_first_page",
      "notes": ""
    }
  ],
  "authors_list_fix": null,
  "resource_links_gold": {
    "original": [
      {
        "index": 0,
        "url": "https://github.com/nicolasfara/experiments-2024-ACSOS-opportunistic-federated-learning",
        "link_class": "official_code",
        "notes": ""
      }
    ],
    "added": []
  },
  "annotator_meta": {
    "annotator_id": "A01",
    "annotated_at": "2026-07-14T16:00:07.623Z",
    "minutes_spent": 1.4,
    "difficulty": "easy",
    "confidence": 0.95
  }
}
