{
  "arxiv_id": "2403.02799",
  "title": "DPPA: Pruning Method for Large Language Model to Model Merging",
  "venue_gold": {
    "status": "preprint",
    "name": null,
    "type": "preprint",
    "year": null,
    "doi": null,
    "evidence_url": null,
    "notes": ""
  },
  "authors_gold": [
    {
      "index": 0,
      "author_name": "Yaochen Zhu",
      "affiliations": [
        {
          "name": "Nanjing University of Science and Technology"
        }
      ],
      "evidence": "pdf_first_page",
      "notes": ""
    },
    {
      "index": 1,
      "author_name": "Rui Xia",
      "affiliations": [
        {
          "name": "Nanjing University of Science and Technology"
        }
      ],
      "evidence": "pdf_first_page",
      "notes": ""
    },
    {
      "index": 2,
      "author_name": "Jiajun Zhang",
      "affiliations": [
        {
          "name": "School of Artificial Intelligence, University of Chinese Academy of Sciences"
        }
      ],
      "evidence": "pdf_first_page",
      "notes": ""
    }
  ],
  "authors_list_fix": null,
  "resource_links_gold": {
    "original": [],
    "added": [
      {
        "url": "https://github.com/northsky0307/DPPA-Pruning-Method-for-Large-Language-Model-to-Model-Merging",
        "link_class": "official_code",
        "evidence_quote": ""
      }
    ]
  },
  "annotator_meta": {
    "annotator_id": "A01",
    "annotated_at": "2026-07-14T12:33:52.017Z",
    "minutes_spent": 1.7,
    "difficulty": "medium",
    "confidence": 0.8
  }
}
