{
  "arxiv_id": "2402.15205",
  "title": "Enhancing ICU Patient Recovery: Using LLMs to Assist Nurses in Diary Writing",
  "venue_gold": {
    "status": "preprint",
    "name": null,
    "type": "preprint",
    "year": null,
    "doi": null,
    "evidence_url": null,
    "notes": "没找到发表信息"
  },
  "authors_gold": [
    {
      "index": 0,
      "author_name": "Samuel Kernan Freire",
      "affiliations": [
        {
          "name": "Delft University of Technology"
        }
      ],
      "evidence": "pdf_first_page",
      "notes": ""
    },
    {
      "index": 1,
      "author_name": "Margo MC van Mol",
      "affiliations": [
        {
          "name": "Erasmuc MC"
        }
      ],
      "evidence": "pdf_first_page",
      "notes": ""
    },
    {
      "index": 2,
      "author_name": "Carola Schol",
      "affiliations": [
        {
          "name": "Erasmuc MC"
        }
      ],
      "evidence": "pdf_first_page",
      "notes": ""
    },
    {
      "index": 3,
      "author_name": "Elif Ozcan Vieira",
      "affiliations": [
        {
          "name": "Delft University of Technology"
        }
      ],
      "evidence": "pdf_first_page",
      "notes": ""
    }
  ],
  "authors_list_fix": null,
  "resource_links_gold": {
    "original": [
      {
        "index": 0,
        "url": "http://dl.acm.org/ccs.cfm",
        "link_class": "template_boilerplate",
        "notes": ""
      }
    ],
    "added": []
  },
  "annotator_meta": {
    "annotator_id": "A01",
    "annotated_at": "2026-07-14T11:38:05.301Z",
    "minutes_spent": 92.7,
    "difficulty": "medium",
    "confidence": 0.8
  }
}
