{
  "arxiv_id": "2402.00031",
  "title": "An Integrated Framework for Team Formation and Winner Prediction in the FIRST Robotics Competition: Model, Algorithm, and Analysis",
  "venue_gold": {
    "status": "published",
    "name": "HPCC/DSS/SmartCity/DependSys 2023",
    "type": "journal",
    "year": 2023,
    "doi": "10.1109/HPCC-DSS-SmartCity-DependSys60770.2023.00126",
    "evidence_url": "https://ieeexplore.ieee.org/abstract/document/10466869",
    "notes": ""
  },
  "authors_gold": [
    {
      "index": 0,
      "author_name": "Federico Galbiati",
      "affiliations": [
        {
          "name": "Department of Computer Science, Worcester Polytechnic Institute"
        }
      ],
      "evidence": "pdf_first_page",
      "notes": ""
    },
    {
      "index": 1,
      "author_name": "Ranier X. Gran",
      "affiliations": [
        {
          "name": "Data Science Program, Worcester Polytechnic Institute"
        }
      ],
      "evidence": "pdf_first_page",
      "notes": ""
    },
    {
      "index": 2,
      "author_name": "Brendan D. Jacques",
      "affiliations": [
        {
          "name": "Data Science Program, Worcester Polytechnic Institute"
        }
      ],
      "evidence": "pdf_first_page",
      "notes": ""
    },
    {
      "index": 3,
      "author_name": "Sullivan J. Mulhern",
      "affiliations": [
        {
          "name": "Department of Computer Science, Worcester Polytechnic Institute"
        }
      ],
      "evidence": "pdf_first_page",
      "notes": ""
    },
    {
      "index": 4,
      "author_name": "Chun-Kit Ngan",
      "affiliations": [
        {
          "name": "Data Science Program, Worcester Polytechnic Institute"
        }
      ],
      "evidence": "pdf_first_page",
      "notes": ""
    }
  ],
  "authors_list_fix": null,
  "resource_links_gold": {
    "original": [],
    "added": []
  },
  "annotator_meta": {
    "annotator_id": "A01",
    "annotated_at": "2026-07-14T02:18:19.469Z",
    "minutes_spent": 2.2,
    "difficulty": "easy",
    "confidence": 1
  }
}
