{
  "arxiv_id": "2403.20329",
  "title": "ReALM: Reference Resolution as Language Modeling",
  "venue_gold": {
    "status": "published",
    "name": "SIGDIAL 2024",
    "type": "conference",
    "year": 2024,
    "doi": null,
    "evidence_url": null,
    "notes": "没找到DOI号"
  },
  "authors_gold": [
    {
      "index": 0,
      "author_name": "Joel Ruben Antony Moniz",
      "affiliations": [
        {
          "name": "Apple"
        }
      ],
      "evidence": "pdf_first_page",
      "notes": ""
    },
    {
      "index": 1,
      "author_name": "Soundarya Krishnan",
      "affiliations": [
        {
          "name": "Apple"
        }
      ],
      "evidence": "pdf_first_page",
      "notes": ""
    },
    {
      "index": 2,
      "author_name": "Melis Ozyildirim",
      "affiliations": [
        {
          "name": "Apple"
        }
      ],
      "evidence": "pdf_first_page",
      "notes": ""
    },
    {
      "index": 3,
      "author_name": "Prathamesh Saraf",
      "affiliations": [
        {
          "name": "Apple"
        }
      ],
      "evidence": "pdf_first_page",
      "notes": ""
    },
    {
      "index": 4,
      "author_name": "Halim Cagri Ates",
      "affiliations": [
        {
          "name": "Apple"
        }
      ],
      "evidence": "pdf_first_page",
      "notes": ""
    },
    {
      "index": 5,
      "author_name": "Yuan Zhang",
      "affiliations": [
        {
          "name": "Apple"
        }
      ],
      "evidence": "pdf_first_page",
      "notes": ""
    },
    {
      "index": 6,
      "author_name": "Hong Yu",
      "affiliations": [
        {
          "name": "Apple"
        }
      ],
      "evidence": "pdf_first_page",
      "notes": ""
    },
    {
      "index": 7,
      "author_name": "Nidhi Rajshree",
      "affiliations": [
        {
          "name": "Apple"
        }
      ],
      "evidence": "pdf_first_page",
      "notes": ""
    }
  ],
  "authors_list_fix": null,
  "resource_links_gold": {
    "original": [
      {
        "index": 0,
        "url": "https://www.latex-project.org/help/documentation/encguide.pdf",
        "link_class": "template_boilerplate",
        "notes": ""
      }
    ],
    "added": []
  },
  "annotator_meta": {
    "annotator_id": "A01",
    "annotated_at": "2026-07-14T15:45:04.263Z",
    "minutes_spent": 3.8,
    "difficulty": "medium",
    "confidence": 0.85
  }
}
