{
  "arxiv_id": "2404.04969",
  "title": "Temporal Generalization Estimation in Evolving Graphs",
  "venue_gold": {
    "status": "published",
    "name": "ICLR 2024",
    "type": "conference",
    "year": 2024,
    "doi": null,
    "evidence_url": "https://dblp.org/rec/conf/iclr/0005MGWZZL24.html?view=bibtex",
    "notes": "没找到DOI"
  },
  "authors_gold": [
    {
      "index": 0,
      "author_name": "Bin Lu",
      "affiliations": [
        {
          "name": "Department of Electronic Engineering, Shanghai Jiao Tong University"
        }
      ],
      "evidence": "pdf_first_page",
      "notes": ""
    },
    {
      "index": 1,
      "author_name": "Tingyan Ma",
      "affiliations": [
        {
          "name": "Department of Electronic Engineering, Shanghai Jiao Tong University"
        }
      ],
      "evidence": "pdf_first_page",
      "notes": ""
    },
    {
      "index": 2,
      "author_name": "Xiaoying Gan",
      "affiliations": [
        {
          "name": "Department of Electronic Engineering, Shanghai Jiao Tong University"
        }
      ],
      "evidence": "pdf_first_page",
      "notes": ""
    },
    {
      "index": 3,
      "author_name": "Xinbing Wang",
      "affiliations": [
        {
          "name": "Department of Electronic Engineering, Shanghai Jiao Tong University"
        }
      ],
      "evidence": "pdf_first_page",
      "notes": ""
    },
    {
      "index": 4,
      "author_name": "Yunqiang Zhu",
      "affiliations": [
        {
          "name": "Institute of Geographic Sciences and Natural Resources Research, Chinese Academy of Sciences"
        }
      ],
      "evidence": "pdf_first_page",
      "notes": ""
    },
    {
      "index": 5,
      "author_name": "Cheng Zhou",
      "affiliations": [
        {
          "name": "Institute of Geographic Sciences and Natural Resources Research, Chinese Academy of Sciences"
        }
      ],
      "evidence": "pdf_first_page",
      "notes": ""
    },
    {
      "index": 6,
      "author_name": "Shiyu Liang",
      "affiliations": [
        {
          "name": "John Hopcroft Center for Computer Science, Shanghai Jiao Tong University"
        }
      ],
      "evidence": "pdf_first_page",
      "notes": ""
    }
  ],
  "authors_list_fix": null,
  "resource_links_gold": {
    "original": [
      {
        "index": 0,
        "url": "https://networkx.org/documentation/stable/reference/generated/networkx.generators.random_graphs.barabasi_albert_graph.html",
        "link_class": "other",
        "notes": ""
      },
      {
        "index": 1,
        "url": "https://networkx.org/documentation/stable/reference/generated/networkx.generators.random_graphs.dual_barabasi_albert_graph.html",
        "link_class": "other",
        "notes": ""
      },
      {
        "index": 2,
        "url": "https://anonymous.4open.science/r/Smart/",
        "link_class": "other",
        "notes": ""
      },
      {
        "index": 3,
        "url": "https://github.com/goodfeli/dlbook_notation",
        "link_class": "cited_external",
        "notes": ""
      }
    ],
    "added": []
  },
  "annotator_meta": {
    "annotator_id": "A01",
    "annotated_at": "2026-07-14T15:50:52.184Z",
    "minutes_spent": 3.7,
    "difficulty": "medium",
    "confidence": 0.75
  }
}
