{
  "arxiv_id": "2402.01537",
  "title": "Closing the Gap in Human Behavior Analysis: A Pipeline for Synthesizing Trimodal Data",
  "venue_gold": {
    "status": "published",
    "name": "PerCom Workshops 2024",
    "type": "workshop",
    "year": 2024,
    "doi": "10.1109/PerComWorkshops59983.2024.10503351",
    "evidence_url": "https://ieeexplore.ieee.org/abstract/document/10503351",
    "notes": ""
  },
  "authors_gold": [
    {
      "index": 0,
      "author_name": "Christian Stippel",
      "affiliations": [
        {
          "name": "Computer Vision Lab, TU Wien"
        }
      ],
      "evidence": "pdf_first_page",
      "notes": ""
    },
    {
      "index": 1,
      "author_name": "Thomas Heitzinger",
      "affiliations": [
        {
          "name": "Computer Vision Lab, TU Wien"
        }
      ],
      "evidence": "pdf_first_page",
      "notes": ""
    },
    {
      "index": 2,
      "author_name": "Rafael Sterzinger",
      "affiliations": [
        {
          "name": "Computer Vision Lab, TU Wien"
        }
      ],
      "evidence": "pdf_first_page",
      "notes": ""
    },
    {
      "index": 3,
      "author_name": "Martin Kampel",
      "affiliations": [
        {
          "name": "Computer Vision Lab, TU Wien"
        }
      ],
      "evidence": "pdf_first_page",
      "notes": ""
    }
  ],
  "authors_list_fix": null,
  "resource_links_gold": {
    "original": [],
    "added": []
  },
  "annotator_meta": {
    "annotator_id": "A01",
    "annotated_at": "2026-07-14T02:20:04.951Z",
    "minutes_spent": 1.7,
    "difficulty": "easy",
    "confidence": 1
  }
}
