{
  "arxiv_id": "2402.05660",
  "title": "Rethinking Propagation for Unsupervised Graph Domain Adaptation",
  "venue_gold": {
    "status": "published",
    "name": "AAAI 2024",
    "type": "conference",
    "year": 2024,
    "doi": "10.1609/aaai.v38i12.29304",
    "evidence_url": "https://dl.acm.org/doi/abs/10.1609/aaai.v38i12.29304",
    "notes": ""
  },
  "authors_gold": [
    {
      "index": 0,
      "author_name": "Meihan Liu",
      "affiliations": [
        {
          "name": "Zhejiang Provincial Key Laboratory of Service Robot, College of Computer Science, Zhejiang University"
        }
      ],
      "evidence": "pdf_first_page",
      "notes": ""
    },
    {
      "index": 1,
      "author_name": "Zeyu Fang",
      "affiliations": [
        {
          "name": "Zhejiang Provincial Key Laboratory of Service Robot, College of Computer Science, Zhejiang University"
        }
      ],
      "evidence": "pdf_first_page",
      "notes": ""
    },
    {
      "index": 2,
      "author_name": "Zhen Zhang",
      "affiliations": [
        {
          "name": "Department of Computer Science, National University of Singapore"
        }
      ],
      "evidence": "pdf_first_page",
      "notes": ""
    },
    {
      "index": 3,
      "author_name": "Ming Gu",
      "affiliations": [
        {
          "name": "Zhejiang Provincial Key Laboratory of Service Robot, College of Computer Science, Zhejiang University"
        }
      ],
      "evidence": "pdf_first_page",
      "notes": ""
    },
    {
      "index": 4,
      "author_name": "Sheng Zhou",
      "affiliations": [
        {
          "name": "Zhejiang Provincial Key Laboratory of Service Robot, College of Computer Science, Zhejiang University"
        },
        {
          "name": "School of Software Technology, Zhejiang University"
        }
      ],
      "evidence": "pdf_first_page",
      "notes": ""
    },
    {
      "index": 5,
      "author_name": "Xin Wang",
      "affiliations": [
        {
          "name": "Department of Computer Science and Technology, Tsinghua University"
        }
      ],
      "evidence": "pdf_first_page",
      "notes": ""
    },
    {
      "index": 6,
      "author_name": "Jiajun Bu",
      "affiliations": [
        {
          "name": "Zhejiang Provincial Key Laboratory of Service Robot, College of Computer Science, Zhejiang University"
        }
      ],
      "evidence": "pdf_first_page",
      "notes": ""
    }
  ],
  "authors_list_fix": null,
  "resource_links_gold": {
    "original": [
      {
        "index": 0,
        "url": "https://github.com/Meihan-Liu/24AAAI-A2GNN",
        "link_class": "official_code",
        "notes": ""
      },
      {
        "index": 1,
        "url": "https://github.com/yuntaodu/ASN/tree/main/data",
        "link_class": "cited_external",
        "notes": ""
      },
      {
        "index": 2,
        "url": "http://snap.stanford.edu/data/twitch-social-networks.html",
        "link_class": "cited_external",
        "notes": ""
      }
    ],
    "added": []
  },
  "annotator_meta": {
    "annotator_id": "A01",
    "annotated_at": "2026-07-14T15:36:54.940Z",
    "minutes_spent": 3,
    "difficulty": "easy",
    "confidence": 1
  }
}
