{
  "arxiv_id": "2404.01652",
  "title": "Towards Better Generalization in Open-Domain Question Answering by Mitigating Context Memorization",
  "venue_gold": {
    "status": "published",
    "name": "NAACL 2024",
    "type": "conference",
    "year": 2024,
    "doi": "10.18653/v1/2024.findings-naacl.48",
    "evidence_url": "https://aclanthology.org/2024.findings-naacl.48/",
    "notes": ""
  },
  "authors_gold": [
    {
      "index": 0,
      "author_name": "Zixuan Zhang",
      "affiliations": [
        {
          "name": "University of Illinois Urbana-Champaign"
        }
      ],
      "evidence": "pdf_first_page",
      "notes": ""
    },
    {
      "index": 1,
      "author_name": "R. Reddy",
      "affiliations": [
        {
          "name": "University of Illinois Urbana-Champaign"
        }
      ],
      "evidence": "pdf_first_page",
      "notes": ""
    },
    {
      "index": 2,
      "author_name": "Kevin Small",
      "affiliations": [
        {
          "name": "Amazon"
        }
      ],
      "evidence": "pdf_first_page",
      "notes": ""
    },
    {
      "index": 3,
      "author_name": "Tong Zhang",
      "affiliations": [
        {
          "name": "University of Illinois Urbana-Champaign"
        }
      ],
      "evidence": "pdf_first_page",
      "notes": ""
    },
    {
      "index": 4,
      "author_name": "Heng Ji",
      "affiliations": [
        {
          "name": "Amazon"
        }
      ],
      "evidence": "pdf_first_page",
      "notes": ""
    }
  ],
  "authors_list_fix": null,
  "resource_links_gold": {
    "original": [
      {
        "index": 0,
        "url": "https://link.springer.com/referenceworkentry/10.1007/978-1-4419-1428-6_245",
        "link_class": "cited_external",
        "notes": ""
      },
      {
        "index": 1,
        "url": "https://github.com/zhangzx-uiuc/CIT",
        "link_class": "official_code",
        "notes": ""
      },
      {
        "index": 2,
        "url": "https://pubmed.ncbi.nlm.nih.gov/",
        "link_class": "cited_external",
        "notes": ""
      },
      {
        "index": 3,
        "url": "https://ai.google.com/research/NaturalQuestions",
        "link_class": "cited_external",
        "notes": ""
      },
      {
        "index": 4,
        "url": "https://github.com/rujunhan/RobustQA-data",
        "link_class": "cited_external",
        "notes": ""
      },
      {
        "index": 5,
        "url": "https://github.com/facebookresearch/QA-Overlap",
        "link_class": "cited_external",
        "notes": ""
      },
      {
        "index": 6,
        "url": "https://github.com/awslabs/robustqa-acl23",
        "link_class": "cited_external",
        "notes": ""
      },
      {
        "index": 7,
        "url": "https://sites.google.com/view/fiqa/home",
        "link_class": "cited_external",
        "notes": ""
      },
      {
        "index": 8,
        "url": "https://www.latex-project.org/help/documentation/encguide.pdf",
        "link_class": "template_boilerplate",
        "notes": ""
      }
    ],
    "added": []
  },
  "annotator_meta": {
    "annotator_id": "A01",
    "annotated_at": "2026-07-14T15:46:57.760Z",
    "minutes_spent": 1.9,
    "difficulty": "medium",
    "confidence": 0.85
  }
}
