{
  "arxiv_id": "2401.00663",
  "title": "1st Place Solution for 5th LSVOS Challenge: Referring Video Object Segmentation",

  "venue_gold": {
    "status": "published",
    "name": "ICCV 2023 Workshops",
    "type": "workshop",
    "year": 2023,
    "doi": null,
    "evidence_url": "https://dblp.org/rec/journals/corr/abs-2401-00663.html",
    "notes": "Camera-ready appears in ICCV 2023 LSVOS workshop track."
  },

  "authors_gold": [
    {
      "index": 0,
      "author_name": "Zhuoyan Luo",
      "affiliations": [
        {"name": "Tsinghua University", "raw_name": "Tsinghua University"}
      ],
      "evidence": "pdf_first_page",
      "notes": ""
    },
    {
      "index": 1,
      "author_name": "Yicheng Xiao",
      "affiliations": [
        {"name": "Tsinghua University", "raw_name": "Tsinghua University"}
      ],
      "evidence": "pdf_first_page"
    }
  ],

  "authors_list_fix": null,

  "resource_links_gold": {
    "original": [
      {
        "index": 0,
        "url": "https://github.com/RobertLuo1/iccv2023_RVOS_Challenge",
        "link_class": "official_code",
        "notes": "Anchored by abstract: 'Code is available at ...'"
      },
      {
        "index": 1,
        "url": "https://github.com/MCG-NKU/CVPR_Template)",
        "link_class": "template_boilerplate",
        "notes": "Comes from the CVPR LaTeX template's boilerplate comment."
      },
      {
        "index": 2,
        "url": "https://github.com/RobertLuo1/iccv2023\\_RVOS\\_Challenge",
        "link_class": "official_code",
        "notes": "Duplicate of index 0 with escaped underscores; still an official code link."
      }
    ],
    "added": []
  },

  "annotator_meta": {
    "annotator_id": "A01",
    "annotated_at": "2026-07-12T00:00:00+08:00",
    "minutes_spent": 9,
    "difficulty": "easy",
    "confidence": 0.95
  }
}
