{
  "arxiv_id": "2401.13262",
  "title": "Designing Redistribution Mechanisms for Reducing Transaction Fees in Blockchains",
  "venue_gold": {
    "status": "published",
    "name": "AAMAS 2024",
    "type": "conference",
    "year": 2024,
    "doi": "10.5555/3709347.3743991",
    "evidence_url": "https://dl.acm.org/doi/10.5555/3635637.3662891",
    "notes": ""
  },
  "authors_gold": [
    {
      "index": 0,
      "author_name": "Sankarshan Damle",
      "affiliations": [
        {
          "name": "IIIT, Hyderabad"
        }
      ],
      "evidence": "pdf_first_page",
      "notes": ""
    },
    {
      "index": 1,
      "author_name": "Manisha Padala",
      "affiliations": [
        {
          "name": "IISc, Bangalore"
        }
      ],
      "evidence": "pdf_first_page",
      "notes": ""
    },
    {
      "index": 2,
      "author_name": "Sujit Gujar",
      "affiliations": [
        {
          "name": "IIIT, Hyderabad"
        }
      ],
      "evidence": "pdf_first_page",
      "notes": ""
    }
  ],
  "authors_list_fix": null,
  "resource_links_gold": {
    "original": [
      {
        "index": 0,
        "url": "https://www.aamas2024-conference.auckland.ac.nz/calls/submission-instruction/",
        "link_class": "template_boilerplate",
        "notes": ""
      },
      {
        "index": 1,
        "url": "http://ctan.org/pkg/pifont",
        "link_class": "template_boilerplate",
        "notes": ""
      },
      {
        "index": 2,
        "url": "http://dl.acm.org/ccs.cfm",
        "link_class": "template_boilerplate",
        "notes": ""
      }
    ],
    "added": []
  },
  "annotator_meta": {
    "annotator_id": "A01",
    "annotated_at": "2026-07-14T02:12:30.720Z",
    "minutes_spent": 3.2,
    "difficulty": "easy",
    "confidence": 1
  }
}
